{"champions":[{"attack":2,"id":1,"magic":10},{"attack":9,"id":2,"magic":3},{"attack":1,"id":3,"magic":6},{"attack":6,"id":4,"magic":6},{"attack":8,"id":5,"magic":3},{"attack":8,"id":6,"magic":3},{"attack":1,"id":7,"magic":10},{"attack":2,"id":8,"magic":8},{"attack":2,"id":9,"magic":9},{"attack":6,"id":10,"magic":7},{"attack":10,"id":11,"magic":2},{"attack":6,"id":12,"magic":5},{"attack":2,"id":13,"magic":10},{"attack":5,"id":14,"magic":3},{"attack":9,"id":15,"magic":1},{"attack":2,"id":16,"magic":7},{"attack":5,"id":17,"magic":7},{"attack":9,"id":18,"magic":5},{"attack":9,"id":19,"magic":3},{"attack":4,"id":20,"magic":7},{"attack":8,"id":21,"magic":5},{"attack":7,"id":22,"magic":2},{"attack":10,"id":23,"magic":2},{"attack":7,"id":24,"magic":7},{"attack":1,"id":25,"magic":8},{"attack":2,"id":26,"magic":8},{"attack":4,"id":27,"magic":7},{"attack":4,"id":28,"magic":7},{"attack":9,"id":29,"magic":3},{"attack":2,"id":30,"magic":10},{"attack":3,"id":31,"magic":7},{"attack":2,"id":32,"magic":8},{"attack":4,"id":33,"magic":5},{"attack":1,"id":34,"magic":10},{"attack":8,"id":35,"magic":6},{"attack":5,"id":36,"magic":6},{"attack":5,"id":37,"magic":8},{"attack":3,"id":38,"magic":8},{"attack":7,"id":39,"magic":5},{"attack":3,"id":40,"magic":7},{"attack":7,"id":41,"magic":4},{"attack":8,"id":42,"magic":6},{"attack":1,"id":43,"magic":8},{"attack":4,"id":44,"magic":5},{"attack":2,"id":45,"magic":10},{"attack":7,"id":48,"magic":2},{"attack":2,"id":50,"magic":9},{"attack":8,"id":51,"magic":2},{"attack":4,"id":53,"magic":5},{"attack":5,"id":54,"magic":7},{"attack":4,"id":55,"magic":9},{"attack":9,"id":56,"magic":2},{"attack":3,"id":57,"magic":6},{"attack":8,"id":58,"magic":2},{"attack":6,"id":59,"magic":3},{"attack":6,"id":60,"magic":7},{"attack":4,"id":61,"magic":9},{"attack":8,"id":62,"magic":2},{"attack":2,"id":63,"magic":9},{"attack":8,"id":64,"magic":3},{"attack":10,"id":67,"magic":1},{"attack":3,"id":68,"magic":8},{"attack":2,"id":69,"magic":9},{"attack":7,"id":72,"magic":5},{"attack":2,"id":74,"magic":8},{"attack":7,"id":75,"magic":6},{"attack":5,"id":76,"magic":7},{"attack":8,"id":77,"magic":4},{"attack":6,"id":78,"magic":2},{"attack":4,"id":79,"magic":6},{"attack":9,"id":80,"magic":3},{"attack":7,"id":81,"magic":6},{"attack":4,"id":82,"magic":7},{"attack":6,"id":83,"magic":4},{"attack":5,"id":84,"magic":8},{"attack":6,"id":85,"magic":7},{"attack":7,"id":86,"magic":1},{"attack":4,"id":89,"magic":3},{"attack":2,"id":90,"magic":9},{"attack":9,"id":91,"magic":1},{"attack":8,"id":92,"magic":1},{"attack":8,"id":96,"magic":5},{"attack":3,"id":98,"magic":3},{"attack":2,"id":99,"magic":9},{"attack":1,"id":101,"magic":10},{"attack":8,"id":102,"magic":3},{"attack":3,"id":103,"magic":8},{"attack":8,"id":104,"magic":3},{"attack":6,"id":105,"magic":7},{"attack":7,"id":106,"magic":4},{"attack":7,"id":107,"magic":2},{"attack":7,"id":110,"magic":4},{"attack":4,"id":111,"magic":6},{"attack":2,"id":112,"magic":10},{"attack":5,"id":113,"magic":6},{"attack":10,"id":114,"magic":2},{"attack":2,"id":115,"magic":9},{"attack":4,"id":117,"magic":7},{"attack":9,"id":119,"magic":1},{"attack":8,"id":120,"magic":4},{"attack":9,"id":121,"magic":3},{"attack":9,"id":122,"magic":1},{"attack":8,"id":126,"magic":3},{"attack":2,"id":127,"magic":8},{"attack":7,"id":131,"magic":8},{"attack":9,"id":133,"magic":2},{"attack":2,"id":134,"magic":9},{"attack":2,"id":136,"magic":8},{"attack":10,"id":141,"magic":1},{"attack":1,"id":142,"magic":8},{"attack":4,"id":143,"magic":8},{"attack":8,"id":145,"magic":3},{"attack":0,"id":147,"magic":0},{"attack":6,"id":150,"magic":5},{"attack":3,"id":154,"magic":7},{"attack":8,"id":157,"magic":4},{"attack":2,"id":161,"magic":10},{"attack":1,"id":163,"magic":8},{"attack":8,"id":164,"magic":3},{"attack":0,"id":166,"magic":0},{"attack":4,"id":200,"magic":7},{"attack":3,"id":201,"magic":4},{"attack":10,"id":202,"magic":6},{"attack":8,"id":203,"magic":2},{"attack":8,"id":221,"magic":3},{"attack":9,"id":222,"magic":4},{"attack":3,"id":223,"magic":6},{"attack":9,"id":233,"magic":3},{"attack":6,"id":234,"magic":2},{"attack":7,"id":235,"magic":6},{"attack":8,"id":236,"magic":3},{"attack":9,"id":238,"magic":1},{"attack":8,"id":240,"magic":2},{"attack":5,"id":245,"magic":7},{"attack":0,"id":246,"magic":4},{"attack":8,"id":254,"magic":3},{"attack":8,"id":266,"magic":3},{"attack":4,"id":267,"magic":7},{"attack":6,"id":268,"magic":8},{"attack":5,"id":350,"magic":8},{"attack":8,"id":360,"magic":3},{"attack":5,"id":412,"magic":6},{"attack":8,"id":420,"magic":3},{"attack":8,"id":421,"magic":2},{"attack":3,"id":427,"magic":7},{"attack":8,"id":429,"magic":4},{"attack":4,"id":432,"magic":5},{"attack":2,"id":497,"magic":8},{"attack":10,"id":498,"magic":1},{"attack":5,"id":516,"magic":3},{"attack":3,"id":517,"magic":8},{"attack":1,"id":518,"magic":9},{"attack":6,"id":523,"magic":1},{"attack":0,"id":526,"magic":0},{"attack":9,"id":555,"magic":1},{"attack":0,"id":711,"magic":0},{"attack":8,"id":777,"magic":4},{"attack":9,"id":799,"magic":0},{"attack":2,"id":800,"magic":9},{"attack":9,"id":804,"magic":0},{"attack":6,"id":805,"magic":2},{"attack":8,"id":875,"magic":1},{"attack":0,"id":876,"magic":10},{"attack":7,"id":887,"magic":5},{"attack":2,"id":888,"magic":9},{"attack":3,"id":893,"magic":8},{"attack":8,"id":895,"magic":4},{"attack":8,"id":897,"magic":7},{"attack":8,"id":901,"magic":5},{"attack":2,"id":902,"magic":8},{"attack":8,"id":904,"magic":1},{"attack":7,"id":910,"magic":8},{"attack":9,"id":950,"magic":0}],"magicFrom":0.5,"patch":"16.20","physicalBelow":0.43,"schemaVersion":1}
